<?xml version="1.0" encoding="UTF-8"?>
<!DOCTYPE version SYSTEM "../../../lib/pkp/dtd/pluginVersion.dtd">

<!--
  * plugins/generic/recommendByAuthor/version.xml
  *
  * Copyright (c) 2014-2021 Simon Fraser University
  * Copyright (c) 2003-2021 John Willinsky
  * Distributed under the GNU GPL v3. For full terms see the file docs/COPYING.
  *
  * Plugin version information.
  -->
<version>
	<application>recommendByAuthor</application>
	<type>plugins.generic</type>
	<release>1.0.0.0</release>
	<date>2013-04-30</date>
	<lazy-load>1</lazy-load>
	<sitewide>1</sitewide>
	<class>RecommendByAuthorPlugin</class>
</version>
